{
  "key": "save-payment-configuration",
  "version": "1.0.0",
  "domain": "core",
  "flow": "sys-tasks",
  "flowVersion": "1.0.0",
  "tags": [
    "payments",
    "scheduled",
    "configuration",
    "setup"
  ],
  "attributes": {
    "type": "6",
    "config": {
      "url": "http://mockoon:3001/api/payments/schedules",
      "method": "POST",
      "headers": {
        "Content-Type": "application/json"
      },
      "body": {},
      "timeoutSeconds": 10,
      "validateSsl": true
    }
  }
}
