{
  "key": "register-device",
  "version": "1.0.0",
  "domain": "core",
  "flow": "sys-tasks",
  "flowVersion": "1.0.0",
  "tags": [
    "oauth2",
    "device-registration",
    "mfa",
    "user-device",
    "security"
  ],
  "attributes": {
    "type": "6",
    "config": {
      "url": "http://mockoon:3001/api/oauth2/devices/register",
      "method": "POST",
      "headers": {
        "Content-Type": "application/json"
      },
      "body": {},
      "timeoutSeconds": 5,
      "validateSsl": true
    }
  }
}
