{
  "key": "process-order",
  "version": "1.0.0",
  "domain": "core",
  "flow": "sys-tasks",
  "flowVersion": "1.0.0",
  "tags": [
    "ecommerce",
    "order",
    "checkout",
    "dummyjson"
  ],
  "attributes": {
    "type": "6",
    "config": {
      "url": "https://dummyjson.com/recipes/add",
      "method": "POST",
      "headers": {
        "Content-Type": "application/json"
      },
      "timeoutSeconds": 5,
      "validateSsl": false
    }
  }
}
