{
  "key": "validate-client",
  "version": "1.0.0",
  "domain": "core",
  "flow": "sys-tasks",
  "flowVersion": "1.0.0",
  "tags": [
    "oauth2",
    "client-validation",
    "authentication",
    "security"
  ],
  "attributes": {
    "type": "6",
    "config": {
      "url": "http://mockoon:3001/api/oauth2/client/validate",
      "method": "POST",
      "headers": {
        "Content-Type": "application/json"
      },
      "body": {},
      "timeoutSeconds": 5,
      "validateSsl": true
    }
  }
}
