{
  "key": "verify-otp-code",
  "version": "1.0.0",
  "domain": "core",
  "flow": "sys-tasks",
  "flowVersion": "1.0.0",
  "tags": [
    "oauth2",
    "otp",
    "verification",
    "mfa",
    "two-factor"
  ],
  "attributes": {
    "type": "6",
    "config": {
      "url": "http://mockoon:3001/api/oauth2/otp/verify",
      "method": "POST",
      "headers": {
        "Content-Type": "application/json"
      },
      "body": {},
      "timeoutSeconds": 5,
      "validateSsl": true
    }
  }
}
