{
  "key": "auth-login",
  "version": "1.0.0",
  "domain": "core",
  "flow": "sys-tasks",
  "flowVersion": "1.0.0",
  "tags": [
    "ecommerce",
    "authentication",
    "login",
    "dummyjson"
  ],
  "attributes": {
    "type": "6",
    "config": {
      "url": "https://dummyjson.com/auth/login",
      "method": "POST",
      "headers": {
        "Content-Type": "application/json"
      },
      "body": {
      },
      "timeoutSeconds": 3,
      "validateSsl": false
    }
  }
}
