{
  "key": "validate-authorization-code",
  "version": "1.0.0",
  "domain": "core",
  "flow": "sys-tasks",
  "flowVersion": "1.0.0",
  "tags": [
    "oauth2",
    "authorization-code",
    "authentication",
    "pkce",
    "security"
  ],
  "attributes": {
    "type": "6",
    "config": {
      "url": "http://mockoon:3001/api/oauth2/user/validate-authorization-code",
      "method": "POST",
      "headers": {
        "Content-Type": "application/json"
      },
      "body": {},
      "timeoutSeconds": 10,
      "validateSsl": true
    }
  }
}
