{
  "key": "activate-payment-schedule",
  "version": "1.0.0",
  "domain": "core",
  "flow": "sys-tasks",
  "flowVersion": "1.0.0",
  "tags": [
    "payments",
    "scheduled",
    "activation",
    "status"
  ],
  "attributes": {
    "type": "6",
    "config": {
      "url": "http://mockoon:3001/api/payments/schedules/{scheduleId}/activate",
      "method": "PATCH",
      "headers": {
        "Content-Type": "application/json"
      },
      "body": {},
      "timeoutSeconds": 5,
      "validateSsl": true
    }
  }
}
